{
  "format": "lupine-song-v1",
  "speed": 14,
  "loop_row": 0,
  "pulse": {
    "notes": {
      "a": "E5",
      "b": "A#4",
      "c": "B4",
      "d": "E4",
      "e": "D5",
      "f": "A4",
      "g": "G#4",
      "h": "D4"
    },
    "rows": [
      "a.......b.......",
      "c.......d.......",
      "........-.......",
      "e.......f.......",
      "g.......h.......",
      "........-.......",
      "-...............",
      "................",
      "................",
      "................",
      "................",
      "................"
    ]
  },
  "wave": {
    "notes": {
      "a": "E2",
      "b": "A#2",
      "c": "D2",
      "d": "G#2"
    },
    "rows": [
      "a...............",
      "................",
      "b...............",
      "c...............",
      "................",
      "d...............",
      "-...............",
      "................",
      "................",
      "................",
      "................",
      "................"
    ]
  },
  "noise": {
    "notes": {
      "k": "kick",
      "h": "hat"
    },
    "rows": [
      "k...............",
      "................",
      "................",
      "k...............",
      "k...............",
      "................",
      "................",
      "k...............",
      "k...............",
      "................",
      "................",
      "h..............."
    ]
  }
}
