{
  "format": "lupine-song-v1",
  "speed": 9,
  "loop_row": 0,
  "pulse": {
    "notes": {
      "a": "D4",
      "b": "A4",
      "c": "G#4",
      "d": "D5",
      "e": "C5",
      "f": "F4",
      "g": "E5",
      "h": "F5",
      "i": "G4",
      "j": "A#4",
      "k": "E4"
    },
    "rows": [
      "-...............",
      "................",
      "a...b...c...d...",
      "........e...b...",
      "f.......-.......",
      "-...............",
      "a...b...c...d...",
      "........e...g...",
      "h...........-...",
      "............f...",
      "i...b.......e...",
      "j...b.......i...",
      "f...k.......a...",
      "............-...",
      "................",
      "............a...",
      "b...c...d.......",
      "....e...b...f...",
      "....-.......f...",
      "i...b.......e...",
      "j...b.......d...",
      "............-...",
      "............-...",
      "................",
      "................",
      "................",
      "................",
      "................",
      "................",
      "................",
      "................",
      "................"
    ]
  },
  "wave": {
    "notes": {
      "a": "D2",
      "b": "D3",
      "c": "A2",
      "d": "C3",
      "e": "A#2",
      "f": "F2",
      "g": "C2",
      "h": "G2"
    },
    "rows": [
      "a.b.a.c.a.b.d.c.",
      "a.b.a.c.a.b.d.c.",
      "a.b.a.c.a.b.d.c.",
      "a.b.a.c.a.b.d.c.",
      "e.e.f.e.g.d.h.d.",
      "e.e.f.e.g.d.h.d.",
      "a.b.a.c.a.b.d.c.",
      "a.b.a.c.a.b.d.c.",
      "a.b.a.c.a.b.d.c.",
      "a.b.a.c.a.b.d.c.",
      "a.b.a.c.a.b.d.c.",
      "a.b.a.c.a.b.d.c.",
      "e.e.f.e.g.d.h.d.",
      "e.e.f.e.g.d.h.d.",
      "a.b.a.c.a.b.d.c.",
      "a.b.a.c.a.b.d.c.",
      "-...............",
      "................",
      "................",
      "................",
      "................",
      "................",
      "................",
      "................",
      "................",
      "................",
      "................",
      "................",
      "................",
      "................",
      "................",
      "................"
    ]
  },
  "noise": {
    "notes": {
      "k": "kick",
      "h": "hat",
      "s": "snare"
    },
    "rows": [
      "k...h...s...h...",
      "k...k...s...h...",
      "k...h...s...h...",
      "k...k...s...h...",
      "k...h...s...h...",
      "k...k...s...h...",
      "k...h...s...h...",
      "k...k...s...h...",
      "k...h...s...h...",
      "k...k...s...h...",
      "k...h...s...h...",
      "k...k...s...h...",
      "k...h...s...h...",
      "k...k...s...h...",
      "k...h...s...h...",
      "k...k...s...h...",
      "k...h...s...h...",
      "k...k...s...h...",
      "k...h...s...h...",
      "k...k...s...h...",
      "k...h...s...h...",
      "k...k...s...h...",
      "k...h...s...h...",
      "k...k...s...h...",
      "k...h...s...h...",
      "k...k...s...h...",
      "k...h...s...h...",
      "k...k...s...h...",
      "k...h...s...h...",
      "k...k...s...h...",
      "k...h...s...h...",
      "k...k...s...h..."
    ]
  }
}
