{
  "format": "lupine-song-v1",
  "speed": 10,
  "loop_row": 16,
  "pulse": {
    "notes": {
      "a": "E3",
      "b": "E4",
      "c": "B4",
      "d": "A#4",
      "e": "E5",
      "f": "D5",
      "g": "C5",
      "h": "G4",
      "i": "F#4",
      "j": "G5",
      "k": "F#5"
    },
    "rows": [
      "a...............",
      "b...c...d...e...",
      "........-.......",
      "b...c...d...e...",
      "........f...g...",
      "c.......b...c...",
      "d...h...i.......",
      "-.......b...c...",
      "d...e...........",
      "j...k...e.......",
      "c.......d.......",
      "c...............",
      "-...............",
      "................",
      "................",
      "................",
      "................",
      "................",
      "................",
      "................",
      "................"
    ]
  },
  "wave": {
    "notes": {
      "a": "E2",
      "b": "B2",
      "c": "A#2"
    },
    "rows": [
      "a...............",
      "a.......b.......",
      "a.......c.......",
      "a.......b.......",
      "a.......c.......",
      "a.......b.......",
      "a.......c.......",
      "a.......b.......",
      "a.......c.......",
      "a.......b.......",
      "a.......c.......",
      "a...............",
      "b...............",
      "a...............",
      "a...............",
      "c.......b.......",
      "a...............",
      "-...............",
      "................",
      "................",
      "................"
    ]
  },
  "noise": {
    "notes": {
      "h": "hat",
      "k": "kick"
    },
    "rows": [
      "h.......h.......",
      "k.......h.......",
      "k...h...h.......",
      "k.......h.......",
      "k...h...h.......",
      "k.......h.......",
      "k...h...h.......",
      "k.......h.......",
      "k...h...h.......",
      "k.......h.......",
      "k...h...h.......",
      "k.......h.......",
      "k...h...h.......",
      "k.......h.......",
      "k...h...h.......",
      "k.......h.......",
      "k...h...h.......",
      "k.......h.......",
      "k...h...h.......",
      "k.......h.......",
      "k...h...h......."
    ]
  }
}
