{
  "format": "lupine-song-v1",
  "speed": 7,
  "loop_row": 0,
  "pulse": {
    "notes": {
      "a": "E5",
      "b": "F5",
      "c": "A#4",
      "d": "E4",
      "e": "B4",
      "f": "A4",
      "g": "G#4"
    },
    "rows": [
      "-...............",
      "................",
      "a.-.a.b.-...c...",
      "a.-.a.b.-...c...",
      "a.-.a.b.-...c...",
      "a.-.a.b.-...c...",
      "d...e...c...a...",
      "b.......a.......",
      "a.-.a.b.-...c...",
      "a.-.a.b.-...c...",
      "a.-.a.b.-...c...",
      "a.-.a.b.-...c...",
      "e.......c.......",
      "f.......g.......",
      "-...............",
      "................",
      "................",
      "................",
      "................",
      "................",
      "................",
      "................",
      "................",
      "................",
      "................",
      "................",
      "................",
      "................",
      "................",
      "................",
      "................",
      "................"
    ]
  },
  "wave": {
    "notes": {
      "a": "E2",
      "b": "F2",
      "c": "A#2",
      "d": "A2"
    },
    "rows": [
      "a.a.b.a.c...d.a.",
      "a.a.b.a.c...d.a.",
      "a.a.b.a.c...d.a.",
      "a.a.b.a.c...d.a.",
      "a.a.b.a.c...d.a.",
      "a.a.b.a.c...d.a.",
      "a.a.b.a.c...d.a.",
      "a.a.b.a.c...d.a.",
      "a.a.b.a.c...d.a.",
      "a.a.b.a.c...d.a.",
      "a.a.b.a.c...d.a.",
      "a.a.b.a.c...d.a.",
      "a.a.b.a.c...d.a.",
      "a.a.b.a.c...d.a.",
      "a.a.b.a.c...d.a.",
      "a.a.b.a.c...d.a.",
      "-...............",
      "................",
      "................",
      "................",
      "................",
      "................",
      "................",
      "................",
      "................",
      "................",
      "................",
      "................",
      "................",
      "................",
      "................",
      "................"
    ]
  },
  "noise": {
    "notes": {
      "k": "kick",
      "s": "snare",
      "h": "hat"
    },
    "rows": [
      "k...k...s...k...",
      "k...k...s...h.s.",
      "k...k...s...k...",
      "k...k...s...h.s.",
      "k...k...s...k...",
      "k...k...s...h.s.",
      "k...k...s...k...",
      "k...k...s...h.s.",
      "k...k...s...k...",
      "k...k...s...h.s.",
      "k...k...s...k...",
      "k...k...s...h.s.",
      "k...k...s...k...",
      "k...k...s...h.s.",
      "k...k...s...k...",
      "k...k...s...h.s.",
      "k...k...s...k...",
      "k...k...s...h.s.",
      "k...k...s...k...",
      "k...k...s...h.s.",
      "k...k...s...k...",
      "k...k...s...h.s.",
      "k...k...s...k...",
      "k...k...s...h.s.",
      "k...k...s...k...",
      "k...k...s...h.s.",
      "k...k...s...k...",
      "k...k...s...h.s.",
      "k...k...s...k...",
      "k...k...s...h.s.",
      "k...k...s...k...",
      "k...k...s...h.s."
    ]
  }
}
