{
  "format": "lupine-song-v1",
  "speed": 8,
  "loop_row": 0,
  "pulse": {
    "notes": {"c": "C5", "e": "E5", "g": "G5", "a": "A4", "f": "F4", "d": "D5", "b": "B4"},
    "rows": ["c...e...g...e...", "a...c...e...c...", "f...a...c...a...", "g...b...d...-..."]
  },
  "wave": {
    "notes": {"C": "C3", "A": "A2", "F": "F2", "G": "G2"},
    "rows": ["C.......C.......", "A.......A.......", "F.......F.......", "G.......G......."]
  },
  "noise": {
    "notes": {"k": "kick", "s": "snare", "h": "hat"},
    "rows": ["k.......s.......", "k.......s.......", "k.......s.......", "k.......s...h.h."]
  }
}
