{
  "format": "lupine-song-v1",
  "speed": 9,
  "loop_row": 0,
  "pulse": {
    "notes": {
      "a": "A3",
      "b": "E4",
      "c": "A4",
      "d": "C5",
      "e": "E5",
      "f": "F3",
      "g": "C4",
      "h": "F4",
      "i": "G3",
      "j": "D4",
      "k": "G4",
      "l": "B4",
      "m": "D5",
      "n": "E3",
      "o": "B3",
      "p": "G#4"
    },
    "rows": [
      "a.b.c.d.e.d.c.b.",
      "a.b.c.d.e.d.c.b.",
      "f.g.h.c.d.c.h.g.",
      "f.g.h.c.d.c.h.g.",
      "i.j.k.l.m.l.k.j.",
      "i.j.k.l.m.l.k.j.",
      "n.o.b.p.l.p.b.o.",
      "n.o.b.p.l.p.b.o.",
      "a.b.c.d.e.d.c.b.",
      "a.b.c.d.e.d.c.b.",
      "f.g.h.c.d.c.h.g.",
      "f.g.h.c.d.c.h.g.",
      "i.j.k.l.m.l.k.j.",
      "i.j.k.l.m.l.k.j.",
      "n.o.b.p.l.p.b.o.",
      "n.o.b.p.l.p.b.o.",
      "-...............",
      "................",
      "................",
      "................",
      "................",
      "................",
      "................",
      "................",
      "................",
      "................",
      "................",
      "................",
      "................",
      "................",
      "................",
      "................"
    ]
  },
  "wave": {
    "notes": {
      "a": "A2",
      "b": "F2",
      "c": "G2",
      "d": "E2",
      "e": "B2"
    },
    "rows": [
      "a...............",
      "................",
      "b...............",
      "................",
      "c...............",
      "................",
      "d...............",
      "e...............",
      "a...............",
      "................",
      "b...............",
      "................",
      "c...............",
      "................",
      "d...............",
      "e...............",
      "-...............",
      "................",
      "................",
      "................",
      "................",
      "................",
      "................",
      "................",
      "................",
      "................",
      "................",
      "................",
      "................",
      "................",
      "................",
      "................"
    ]
  },
  "noise": {
    "notes": {
      "k": "kick",
      "h": "hat",
      "s": "snare"
    },
    "rows": [
      "k...............",
      "h.......h.......",
      "k...............",
      "h.......h.......",
      "k...............",
      "h.......h.......",
      "k...............",
      "h.......h.......",
      "k...............",
      "h.......h.......",
      "k...............",
      "h.......h.......",
      "k...............",
      "h.......h.......",
      "k...............",
      "h.......h.......",
      "k.......h...s...",
      "k...h...s...h...",
      "k.......h...s...",
      "k...h...s...h...",
      "k.......h...s...",
      "k...h...s...h...",
      "k.......h...s...",
      "k...h...s...h...",
      "k.......h...s...",
      "k...h...s...h...",
      "k.......h...s...",
      "k...h...s...h...",
      "k.......h...s...",
      "k...h...s...h...",
      "k.......h...s...",
      "k...h...s...h..."
    ]
  }
}
