{
  "format": "lupine-song-v1",
  "speed": 10,
  "loop_row": 16,
  "pulse": {
    "notes": {
      "a": "E4",
      "b": "B4",
      "c": "A#4",
      "d": "E5",
      "e": "G#5",
      "f": "F#5",
      "g": "B5"
    },
    "rows": [
      "-...............",
      "a...b...c.b.....",
      "d...............",
      "e.......f.......",
      "d...............",
      "a...b...c.b.....",
      "d...............",
      "g.......e.......",
      "d.......f.......",
      "d...............",
      "................",
      "-...............",
      "................",
      "................",
      "................",
      "................",
      "................",
      "................",
      "................",
      "................",
      "................",
      "................",
      "................",
      "................",
      "................",
      "................",
      "................",
      "................"
    ]
  },
  "wave": {
    "notes": {
      "a": "E2",
      "b": "B2",
      "c": "C#3",
      "d": "A2"
    },
    "rows": [
      "a...............",
      "a...............",
      "b...............",
      "c...............",
      "d...............",
      "a...............",
      "b...............",
      "c...............",
      "d...............",
      "a...............",
      "b...............",
      "c...............",
      "d...............",
      "a...............",
      "a...............",
      "-...............",
      "................",
      "................",
      "................",
      "................",
      "................",
      "................",
      "................",
      "................",
      "................",
      "................",
      "................",
      "................"
    ]
  },
  "noise": {
    "notes": {
      "h": "hat",
      "k": "kick",
      "s": "snare"
    },
    "rows": [
      "h...............",
      "h...............",
      "k.......h.......",
      "s.......h.......",
      "k.......h.......",
      "s.......h.......",
      "k.......h.......",
      "s.......h.......",
      "k.......h.......",
      "s.......h.......",
      "k.......h.......",
      "s.......h.......",
      "k.......h.......",
      "s.......h.......",
      "k.......h.......",
      "s.......h.......",
      "k.......h.......",
      "s.......h.......",
      "k.......h.......",
      "s.......h.......",
      "k.......h.......",
      "s.......h.......",
      "k.......h.......",
      "s.......h.......",
      "k.......h.......",
      "s.......h.......",
      "k.......h.......",
      "s.......h......."
    ]
  }
}
