{
  "format": "lupine-song-v1",
  "speed": 8,
  "loop_row": 0,
  "pulse": {
    "notes": {
      "a": "C5",
      "b": "G5",
      "c": "F#5",
      "d": "C6",
      "e": "A#5",
      "f": "D#5",
      "g": "G4",
      "h": "G#4"
    },
    "rows": [
      "-...............",
      "................",
      "................",
      "................",
      "a...b...c...d...",
      "........e...b...",
      "f.......-.......",
      "a...b...c...f...",
      "........-.......",
      "............g.-.",
      "g.-.g.-.g.-.h.-.",
      "h.-.h.-.h.-.g.-.",
      "g.-.g.-.g.-.h.-.",
      "h.-.h.-.h.-.-...",
      "................",
      "............a...",
      "b...c...d.......",
      "....e...b...f...",
      "....-.......-...",
      "................",
      "............-...",
      "................",
      "................",
      "................",
      "................",
      "................",
      "................",
      "................",
      "................",
      "................",
      "................",
      "................"
    ]
  },
  "wave": {
    "notes": {
      "a": "C2",
      "b": "G2",
      "c": "D#2",
      "d": "F2",
      "e": "F#2",
      "f": "G#2",
      "g": "D2"
    },
    "rows": [
      "a.a.b.a.c.a.d.e.",
      "a.a.b.a.c.a.d.e.",
      "a.a.b.a.c.a.d.e.",
      "a.a.b.a.c.a.d.e.",
      "a.a.b.a.c.a.d.e.",
      "a.a.b.a.c.a.d.e.",
      "f.f.c.f.b.b.g.b.",
      "f.f.c.f.b.b.g.b.",
      "a.a.b.a.c.a.d.e.",
      "a.a.b.a.c.a.d.e.",
      "a.a.b.a.c.a.d.e.",
      "a.a.b.a.c.a.d.e.",
      "f.f.c.f.b.b.g.b.",
      "f.f.c.f.b.b.g.b.",
      "a.a.b.a.c.a.d.e.",
      "a.a.b.a.c.a.d.e.",
      "-...............",
      "................",
      "................",
      "................",
      "................",
      "................",
      "................",
      "................",
      "................",
      "................",
      "................",
      "................",
      "................",
      "................",
      "................",
      "................"
    ]
  },
  "noise": {
    "notes": {
      "k": "kick",
      "h": "hat",
      "s": "snare"
    },
    "rows": [
      "k...h.s.k...h...",
      "k...h.s.k...h.s.",
      "k...h.s.k...h...",
      "k...h.s.k...h.s.",
      "k...h.s.k...h...",
      "k...h.s.k...h.s.",
      "k...h.s.k...h...",
      "k...h.s.k...h.s.",
      "k...h.s.k...h...",
      "k...h.s.k...h.s.",
      "k...h.s.k...h...",
      "k...h.s.k...h.s.",
      "k...h.s.k...h...",
      "k...h.s.k...h.s.",
      "k...h.s.k...h...",
      "k...h.s.k...h.s.",
      "k...h.s.k...h...",
      "k...h.s.k...h.s.",
      "k...h.s.k...h...",
      "k...h.s.k...h.s.",
      "k...h.s.k...h...",
      "k...h.s.k...h.s.",
      "k...h.s.k...h...",
      "k...h.s.k...h.s.",
      "k...h.s.k...h...",
      "k...h.s.k...h.s.",
      "k...h.s.k...h...",
      "k...h.s.k...h.s.",
      "k...h.s.k...h...",
      "k...h.s.k...h.s.",
      "k...h.s.k...h...",
      "k...h.s.k...h.s."
    ]
  }
}
